{"$schema":"https://json-schema.org/draft/2020-12/schema","$id":"urn:edgelab:orchestration-task:3","type":"object","additionalProperties":false,"required":["schema_version","task_id","milestone","task_purpose","action_classification","operation","effects","capability_refs","assigned_role","status","dependencies","handoff_ref","attempt","created_at","updated_at","review_required","reviewer_role","blocking_reason","completion_evidence"],"properties":{"schema_version":{"const":2},"task_id":{"type":"string","pattern":"^T-[A-Z0-9-]+$"},"milestone":{"const":"M0.2"},"task_purpose":{"const":"SYNTHETIC_ORCHESTRATION"},"action_classification":{"enum":["ORCHESTRATION_SCHEMA","HANDOFF_PARSING","REPOSITORY_PREFLIGHT","CLAIM_COORDINATION","COMPLETION_ROUTING","RELEASE_ROUTING","STOP_SCHEDULER_CHECK","AUDIT_LOGGING","SYNTHETIC_TEST","PLUGIN_REGISTRY_SCHEMA","PLUGIN_REVIEW_METADATA"]},"operation":{"enum":["STATE_READ","SCHEMA_WRITE","SYNTHETIC_ASSERT"]},"effects":{"type":"array","minItems":1,"uniqueItems":true,"items":{"enum":["REPOSITORY_READ","REPOSITORY_WRITE"]}},"capability_refs":{"type":"array","minItems":1,"uniqueItems":true,"items":{"type":"string","minLength":1}},"assigned_role":{"const":"00 Director"},"status":{"enum":["QUEUED","CLAIMED","IMPLEMENTED","IN_REVIEW","REJECTED","READY_FOR_DIRECTOR","COMPLETED","BLOCKED"]},"dependencies":{"type":"array","uniqueItems":true,"items":{"type":"string","pattern":"^T-[A-Z0-9-]+$"}},"handoff_ref":{"type":"string","pattern":"^docs/handoffs/H-M0-0[0-9]+\\.v[0-9]+\\.json$"},"attempt":{"type":"integer","minimum":1,"maximum":2147483647},"created_at":{"type":"string","format":"date-time"},"updated_at":{"type":"string","format":"date-time"},"review_required":{"const":true},"reviewer_role":{"const":"05 Skeptic"},"blocking_reason":{"type":["string","null"]},"completion_evidence":{"type":"array","items":{"type":"string","minLength":1}}}}
